"ClassNo","ClassName_fr","FXY","ElementName_fr","BUFR_Unit_fr","BUFR_Scale","BUFR_ReferenceValue","BUFR_DataWidth_Bits","CREX_Unit_fr","CREX_Scale","CREX_DataWidth_Char","Note_fr","noteIDs","Status"
"25","Classe 25 — Informations sur le traitement","025001","Distance de la porte d'intégration","m","-1","0","6","m","-1","2","","","Operational"
"25","Classe 25 — Informations sur le traitement","025002","Nombre moyen de portes","Numérique","0","0","4","Numérique","0","2","","","Operational"
"25","Classe 25 — Informations sur le traitement","025003","Nombre d'impulsions intégrées","Numérique","0","0","8","Numérique","0","3","","","Operational"
"25","Classe 25 — Informations sur le traitement","025004","Traitement des échos","Table de code","0","0","2","Table de code","0","1","","","Operational"
"25","Classe 25 — Informations sur le traitement","025005","Intégration des échos","Table de code","0","0","2","Table de code","0","1","","","Operational"
"25","Classe 25 — Informations sur le traitement","025006","Conversion Z – R","Table de code","0","0","3","Table de code","0","1","","","Operational"
"25","Classe 25 — Informations sur le traitement","025007","Facteur de conversion Z – R","Numérique","0","0","12","Numérique","0","4","","","Operational"
"25","Classe 25 — Informations sur le traitement","025008","Exposant de conversion Z – R","Numérique","2","0","9","Numérique","2","3","","","Operational"
"25","Classe 25 — Informations sur le traitement","025009","Méthode d'étalonnage","Table d'indicateurs","0","0","4","Table d'indicateurs","0","2","(voir note 3)","3","Operational"
"25","Classe 25 — Informations sur le traitement","025010","Traitement des échos fixes","Table de code","0","0","4","Table de code","0","2","","","Operational"
"25","Classe 25 — Informations sur le traitement","025011","Correction des échos de sol (filtrage)","Table de code","0","0","2","Table de code","0","1","","","Operational"
"25","Classe 25 — Informations sur le traitement","025012","Correction de l'atténuation de portée","Table de code","0","0","2","Table de code","0","1","","","Operational"
"25","Classe 25 — Informations sur le traitement","025013","Correction de la bande brillante","Table d'indicateurs","0","0","2","Table d'indicateurs","0","1","","","Operational"
"25","Classe 25 — Informations sur le traitement","025014","Coupure azimutale due au fouillis","Numérique","0","0","12","Numérique","0","4","(voir note 1)","1","Operational"
"25","Classe 25 — Informations sur le traitement","025015","Correction de l'atténuation par le radôme","Table d'indicateurs","0","0","2","Table d'indicateurs","0","1","","","Operational"
"25","Classe 25 — Informations sur le traitement","025016","Correction de l'atténuation en air clair","dB m-¹","5","0","6","dB m-1","5","2","","","Operational"
"25","Classe 25 — Informations sur le traitement","025017","Correction de l'atténuation par les précipitations","Table d'indicateurs","0","0","2","Table d'indicateurs","0","1","","","Operational"
"25","Classe 25 — Informations sur le traitement","025018","Loi reliant A à Z pour le facteur d'atténuation","Numérique","7","0","6","Numérique","7","2","","","Operational"
"25","Classe 25 — Informations sur le traitement","025019","Loi reliant A à Z pour l'exposant d'atténuation","Numérique","2","0","7","Numérique","2","3","","","Operational"
"25","Classe 25 — Informations sur le traitement","025020","Estimation de la vitesse moyenne","Table de code","0","0","2","Table de code","0","1","","","Operational"
"25","Classe 25 — Informations sur le traitement","025021","Renforcement du calcul du vent","Table d'indicateurs","0","0","8","Table d'indicateurs","0","3","","","Operational"
"25","Classe 25 — Informations sur le traitement","025022","Indicateur de rejet des données GHRSST*","Table d'indicateurs","0","0","9","Table d'indicateurs","0","3","","","Operational"
"25","Classe 25 — Informations sur le traitement","025023","Indicateur de confiance des données GHRSST","Table d'indicateurs","0","0","9","Table d'indicateurs","0","3","","","Operational"
"25","Classe 25 — Informations sur le traitement","025024","Qualité des données GHRSST","Table de code","0","0","4","Table de code","0","2","","","Operational"
"25","Classe 25 — Informations sur le traitement","025025","Voltage de la batterie","V","1","0","9","V","1","3","","","Operational"
"25","Classe 25 — Informations sur le traitement","025026","Tension de la batterie (grande portée)","V","1","0","12","V","1","4","","","Operational"
"25","Classe 25 — Informations sur le traitement","025028","Paramètre défini par l'exploitant ou le fabricant","Numérique","1","-16384","15","Numérique","1","5","","","Operational"
"25","Classe 25 — Informations sur le traitement","025029","Méthode d'étalonnage","Table d'indicateurs","0","0","6","Table d'indicateurs","0","2","(voir note 3)","3","Operational"
"25","Classe 25 — Informations sur le traitement","025030","Moyenne mobile de la température de la mer en surface","Table de code","0","0","2","Table de code","0","1","","","Operational"
"25","Classe 25 — Informations sur le traitement","025031","Méthode d'éclaircissage des profils verticaux établis par la prévision numérique du temps","Table de code","0","0","3","Table de code","0","1","","","Operational"
"25","Classe 25 — Informations sur le traitement","025032","Information sur le mode du profileur de vent","Table de code","0","0","2","Table de code","0","1","(voir note 2)","2","Operational"
"25","Classe 25 — Informations sur le traitement","025033","Information sur le sous-mode du profileur de vent","Table de code","0","0","2","Table de code","0","1","(voir note 2)","2","Operational"
"25","Classe 25 — Informations sur le traitement","025034","Résultats des essais de contrôle de la qualité du profileur de vent","Table d'indicateurs","0","0","4","Table d'indicateurs","0","2","(voir note 2)","2","Operational"
"25","Classe 25 — Informations sur le traitement","025035","Méthode de décision pour la polarité","Table de code","0","0","3","Table de code","0","1","(voir note 5)","5","Operational"
"25","Classe 25 — Informations sur le traitement","025036","Méthode de localisation des atmosphériques","Table de code","0","0","4","Table de code","0","2","","","Operational"
"25","Classe 25 — Informations sur le traitement","025037","Biais de la SST","K","2","-127","8","K","2","3","","","Operational"
"25","Classe 25 — Informations sur le traitement","025038","Différence entre la valeur observée de la SST et la valeur analysée","K","1","-127","8","K","1","3","","","Operational"
"25","Classe 25 — Informations sur le traitement","025040","Produit de vent obtenu par traceur au CO2","Table de code","0","0","4","Table de code","0","2","","","Operational"
"25","Classe 25 — Informations sur le traitement","025041","Méthode de transmission de la direction de la plate-forme mobile","Table de code","0","0","2","Table de code","0","1","","","Operational"
"25","Classe 25 — Informations sur le traitement","025042","Méthode de transmission de la vitesse de la plate-forme mobile","Table de code","0","0","2","Table de code","0","1","","","Operational"
"25","Classe 25 — Informations sur le traitement","025043","Intervalle d'échantillonnage des vagues (temps)","s","4","0","15","s","4","5","","","Operational"
"25","Classe 25 — Informations sur le traitement","025044","Intervalle d'échantillonnage des vagues (espace)","m","2","0","14","m","2","5","","","Operational"
"25","Classe 25 — Informations sur le traitement","025045","Combinaison de canaux de sondeur HIRS","Table d'indicateurs","0","0","21","Table d'indicateurs","0","7","","","Operational"
"25","Classe 25 — Informations sur le traitement","025046","Combinaison de canaux de sondeur MSU","Table d'indicateurs","0","0","5","Table d'indicateurs","0","2","","","Operational"
"25","Classe 25 — Informations sur le traitement","025047","Combinaison de canaux de sondeur SSU","Table d'indicateurs","0","0","4","Table d'indicateurs","0","2","","","Operational"
"25","Classe 25 — Informations sur le traitement","025048","Combinaison de canaux de sondeur AMSU-A","Table d'indicateurs","0","0","16","Table d'indicateurs","0","6","","","Operational"
"25","Classe 25 — Informations sur le traitement","025049","Combinaison de canaux de sondeur AMSU-B","Table d'indicateurs","0","0","6","Table d'indicateurs","0","2","","","Operational"
"25","Classe 25 — Informations sur le traitement","025050","Indice de qualité de la composante principale","Numérique","4","-131072","18","Numérique","4","6","","","Operational"
"25","Classe 25 — Informations sur le traitement","025051","Combinaison de canaux de radiomètre AVHRR","Table d'indicateurs","0","0","7","Table d'indicateurs","0","3","","","Operational"
"25","Classe 25 — Informations sur le traitement","025052","Log10 de l'ajustement normalisé aux données des composantes principales","Numérique","4","0","15","Numérique","4","5","","","Operational"
"25","Classe 25 — Informations sur le traitement","025053","Qualité des observations","Table d'indicateurs","0","0","12","Table d'indicateurs","0","4","","","Operational"
"25","Classe 25 — Informations sur le traitement","025054","Numéro d'identification de la sous-trame SSMIS","Numérique","0","0","5","Numérique","0","2","","","Operational"
"25","Classe 25 — Informations sur le traitement","025055","Télémaintenance du multiplexeur","K","2","0","16","K","2","5","","","Operational"
"25","Classe 25 — Informations sur le traitement","025060","Identification du logiciel","Numérique","0","0","14","Numérique","0","5","(voir note 2)","2","Operational"
"25","Classe 25 — Informations sur le traitement","025061","Identification du logiciel et numéro de version","CCITT IA5","0","0","96","Caractère","0","12","","","Operational"
"25","Classe 25 — Informations sur le traitement","025062","Identification de la base de données","Numérique","3","0","10","Numérique","0","5","","","Operational"
"25","Classe 25 — Informations sur le traitement","025063","Indicateur du système ou processeur central","Table de code","0","0","8","Table de code","0","3","(voir note 6)","6","Operational"
"25","Classe 25 — Informations sur le traitement","025065","Correction de l'orientation (azimut)","°","2","-1000","11","°","2","4","","","Operational"
"25","Classe 25 — Informations sur le traitement","025066","Correction de l'orentation (altitude)","°","2","-1000","11","°","2","4","","","Operational"
"25","Classe 25 — Informations sur le traitement","025067","Correction de pression au point de lâcher de la radiosonde","Pa","0","-8000","14","Pa","0","4","","","Operational"
"25","Classe 25 — Informations sur le traitement","025068","Recalcul des archives – nombre de fois","Numérique","0","0","7","Numérique","0","3","","","Operational"
"25","Classe 25 — Informations sur le traitement","025069","Corrections de pression du niveau de vol","Table d'indicateurs","0","0","8","Table d'indicateurs","0","3","","","Operational"
"25","Classe 25 — Informations sur le traitement","025070","Numéro de paquet principal","Numérique","0","0","4","Numérique","0","2","","","Operational"
"25","Classe 25 — Informations sur le traitement","025071","Numéro de paquet","Numérique","0","0","5","Numérique","0","2","","","Operational"
"25","Classe 25 — Informations sur le traitement","025075","Corrections d'antenne de satellite, numéro de version","Numérique","0","0","5","Numérique","0","2","","","Operational"
"25","Classe 25 — Informations sur le traitement","025076","Log10 du numéro d'onde centrale de la luminance énergétique pour la mesure de la température, dans le cas du sondeur ATOVS","Log (m-1)","8","0","30","Log (m-1)","8","10","","","Operational"
"25","Classe 25 — Informations sur le traitement","025077","Coefficient 1 de correction de largeur de bande","Numérique","5","-100000","18","Numérique","5","7","","","Operational"
"25","Classe 25 — Informations sur le traitement","025078","Coefficient 2 de correction de largeur de bande","Numérique","5","0","17","Numérique","5","6","","","Operational"
"25","Classe 25 — Informations sur le traitement","025079","Luminance énergétique d'albédo – éclairement énergétique après filtrage solaire, pour le sondeur ATOVS","W m-2","4","0","24","W m-2","4","8","","","Operational"
"25","Classe 25 — Informations sur le traitement","025080","Luminance énergétique d'albédo – largeur équivalente du filtre, pour le sondeur ATOVS","m","10","0","14","m","10","5","","","Operational"
"25","Classe 25 — Informations sur le traitement","025081","Angle d'incidence","°","3","0","17","°","3","6","","","Operational"
"25","Classe 25 — Informations sur le traitement","025082","Angle d'azimut","°","3","0","19","°","3","6","","","Operational"
"25","Classe 25 — Informations sur le traitement","025083","Angle de rotation Faraday","°","3","0","19","°","3","6","","","Operational"
"25","Classe 25 — Informations sur le traitement","025084","Angle de rotation","°","5","0","26","°","5","8","","","Operational"
"25","Classe 25 — Informations sur le traitement","025085","Fraction de pixels clairs dans le champ de vision du sondeur HIRS","Numérique","0","0","7","Numérique","0","3","","","Operational"
"25","Classe 25 — Informations sur le traitement","025086","Indicateur de correction de la profondeur","Table de code","0","0","2","Table de code","0","1","","","Operational"
"25","Classe 25 — Informations sur le traitement","025090","Indicateur de l'état de l'orbite","Table de code","0","0","4","Table de code","0","2","","","Operational"
"25","Classe 25 — Informations sur le traitement","025091","Constante structurelle de l'indice de réfraction (Cn2)","dB","3","-18192","13","dB","3","5","","","Operational"
"25","Classe 25 — Informations sur le traitement","025092","Vitesse de propagation acoustique","m s-1","2","28000","14","m s-1","2","5","","","Operational"
"25","Classe 25 — Informations sur le traitement","025093","Correction des données RASS (Système de sondage radio-acoustique)","Table d'indicateurs","0","0","8","Table d'indicateurs","0","3","","","Operational"
"25","Classe 25 — Informations sur le traitement","025095","Indicateur de l'état de l'altimètre","Table d'indicateurs","0","0","2","Table d'indicateurs","0","1","","","Operational"
"25","Classe 25 — Informations sur le traitement","025096","Indicateur de l'état du radiomètre","Table d'indicateurs","0","0","5","Table d'indicateurs","0","","","","Operational"
"25","Classe 25 — Informations sur le traitement","025097","Erreur tridimensionnelle estimative de l'orbite du navigateur","Table de code","0","0","4","Table de code","0","","","","Operational"
"25","Classe 25 — Informations sur le traitement","025098","Indicateur de qualité des données de l'altimètre","Table d'indicateurs","0","0","9","Table d'indicateurs","0","","","","Operational"
"25","Classe 25 — Informations sur le traitement","025099","Indicateur de qualité de la correction de l'altimètre","Table d'indicateurs","0","0","9","Table d'indicateurs","0","","","","Operational"
"25","Classe 25 — Informations sur le traitement","025100","Coefficient a de l'équation de la vitesse de chute des XBT/XCTD","Numérique","5","0","20","Numérique","5","","","","Operational"
"25","Classe 25 — Informations sur le traitement","025101","Coefficient b de l'équation de la vitesse de chute des XBT/XCTD","Numérique","5","-500000","21","Numérique","5","","","","Operational"
"25","Classe 25 — Informations sur le traitement","025102","Nombre de lignes manquantes hors données manquantes","Numérique","0","0","8","Numérique","0","","","","Operational"
"25","Classe 25 — Informations sur le traitement","025103","Nombre de cellules en direction","Numérique","0","0","8","Numérique","0","","","","Operational"
"25","Classe 25 — Informations sur le traitement","025104","Nombre de cellules en longueur d'onde","Numérique","0","0","8","Numérique","0","","","","Operational"
"25","Classe 25 — Informations sur le traitement","025105","Première cellule en direction","°","3","0","19","°","3","","","","Operational"
"25","Classe 25 — Informations sur le traitement","025106","Incrément de cellule en direction","°","3","0","19","°","3","","","","Operational"
"25","Classe 25 — Informations sur le traitement","025107","Première cellule en longueur d'onde","m","3","0","29","m","3","","","","Operational"
"25","Classe 25 — Informations sur le traitement","025108","Dernière cellule en longueur d'onde","m","3","0","29","m","3","","","","Operational"
"25","Classe 25 — Informations sur le traitement","025110","Traitement de l'image en abrégé","Table d'indicateurs","0","0","10","Table d'indicateurs","0","","","","Operational"
"25","Classe 25 — Informations sur le traitement","025111","Nombre de données manquantes à la réception","Numérique","0","0","8","Numérique","0","","","","Operational"
"25","Classe 25 — Informations sur le traitement","025112","Indicateur de qualité des données de l'altimètre dans une bande précise","Table d'indicateurs","0","0","9","Table d'indicateurs","0","","","","Operational"
"25","Classe 25 — Informations sur le traitement","025113","Indicateur de qualité de la correction de l'altimètre dans une bande précise","Table d'indicateurs","0","0","9","Table d'indicateurs","0","3","","","Operational"
"25","Classe 25 — Informations sur le traitement","025120","Indicateur de traitement de niveau 2 - données RA-2","Table de code","0","0","2","Table de code","0","1","","","Operational"
"25","Classe 25 — Informations sur le traitement","025121","Qualité du traitement de niveau 2 – données RA-2","%","0","0","7","%","0","3","","","Operational"
"25","Classe 25 — Informations sur le traitement","025122","Configuration matérielle – radiofréquence","Table de code","0","0","2","Table de code","0","1","","","Operational"
"25","Classe 25 — Informations sur le traitement","025123","Configuration matérielle - amplificateur de grande puissance","Table de code","0","0","2","Table de code","0","1","","","Operational"
"25","Classe 25 — Informations sur le traitement","025124","Indicateur de traitement de niveau 2 - données MWR","Table de code","0","0","2","Table de code","0","1","","","Operational"
"25","Classe 25 — Informations sur le traitement","025125","Qualité du traitement de niveau 2 – données MWR","%","0","0","7","%","0","3","","","Operational"
"25","Classe 25 — Informations sur le traitement","025126","Correction de troposphère sèche – modèle","m","3","-32768","16","m","3","5","","","Operational"
"25","Classe 25 — Informations sur le traitement","025127","Correction de baromètre inverse","m","3","-32768","16","m","3","5","","","Operational"
"25","Classe 25 — Informations sur le traitement","025128","Correction de troposphère humide – modèle","m","3","-32768","16","m","3","5","","","Operational"
"25","Classe 25 — Informations sur le traitement","025129","Correction de troposphère humide – données MWR","m","3","-32768","16","m","3","5","","","Operational"
"25","Classe 25 — Informations sur le traitement","025130","Correction ionosphérique – données RA-2 en bande Ku","m","3","-32768","16","m","3","5","","","Operational"
"25","Classe 25 — Informations sur le traitement","025131","Correction ionosphérique – données Doris en bande Ku","m","3","-32768","16","m","3","5","","","Operational"
"25","Classe 25 — Informations sur le traitement","025132","Correction ionosphérique – modèle en bande Ku","m","3","-32768","16","m","3","5","","","Operational"
"25","Classe 25 — Informations sur le traitement","025133","Correction du biais d'état de la mer en bande Ku","m","3","-32768","16","m","3","5","","","Operational"
"25","Classe 25 — Informations sur le traitement","025134","Correction ionosphérique - données RA-2 en bande S","m","3","-32768","16","m","3","5","","","Operational"
"25","Classe 25 — Informations sur le traitement","025135","Correction ionosphérique – données Doris en bande S","m","3","-32768","16","m","3","5","","","Operational"
"25","Classe 25 — Informations sur le traitement","025136","Correction ionosphérique - modèle en bande S","m","3","-32768","16","m","3","5","","","Operational"
"25","Classe 25 — Informations sur le traitement","025137","Correction du biais d'état de la mer en bande S","m","3","-32768","16","m","3","5","","","Operational"
"25","Classe 25 — Informations sur le traitement","025138","Rapport signal-bruit moyen","Numérique","0","-2048","12","Numérique","0","4","","","Operational"
"25","Classe 25 — Informations sur le traitement","025140","Début canal","Numérique","0","0","14","Numérique","0","5","","","Operational"
"25","Classe 25 — Informations sur le traitement","025141","Fin canal","Numérique","0","0","14","Numérique","0","5","","","Operational"
"25","Classe 25 — Informations sur le traitement","025142","Facteur d'échelle du canal","Numérique","0","0","6","Numérique","0","2","","","Operational"
"25","Classe 25 — Informations sur le traitement","025143","Coefficient linéaire","Numérique","6","-5000000","24","Numérique","6","8","","","Operational"
"25","Classe 25 — Informations sur le traitement","025148","Coefficient de variation","Numérique","2","-10000","15","Numérique","2","5","","","Operational"
"25","Classe 25 — Informations sur le traitement","025149","Coût estimatif optimal","Numérique","0","0","8","Numérique","0","3","","","Operational"
"25","Classe 25 — Informations sur le traitement","025150","Méthode d'analyse de l'intensité du cyclone tropical par les images de satellite","Table de code","0","0","4","Table de code","0","2","","","Operational"
"25","Classe 25 — Informations sur le traitement","025160","Correction finale de l'erreur instru-mentale dans la bande Ku","m","4","-120000","18","m","4","6","","","Operational"
"25","Classe 25 — Informations sur le traitement","025161","Correction finale de l'erreur instru-mentale dans la bande C","m","4","-120000","18","m","4","6","","","Operational"
"25","Classe 25 — Informations sur le traitement","025162","Correction du biais d'état de la mer en bande C","m","4","-6000","13","m","4","4","","","Operational"
"25","Classe 25 — Informations sur le traitement","025163","Correction ionosphérique de l'altimètre en bande Ku","m","3","-32768","16","m","3","5","","","Operational"
"25","Classe 25 — Informations sur le traitement","025164","Correction de troposphère humide du radiomètre","m","4","-5000","13","m","4","4","","","Operational"
"25","Classe 25 — Informations sur le traitement","025165","Correction ionosphérique - modèle dans une bande précise","m","4","-32768","16","m","4","5","","","Operational"
"25","Classe 25 — Informations sur le traitement","025166","Correction du biais d'état de la mer dans une bande précise","m","4","-32768","16","m","4","5","","","Operational"
"25","Classe 25 — Informations sur le traitement","025167","Correction finale de l'erreur instru-mentale dans une bande précise","m","4","-120000","18","m","4","6","","","Operational"
"25","Classe 25 — Informations sur le traitement","025170","Intervalle d'échantillonnage (temps)","s","0","0","10","s","0","4","","","Operational"
"25","Classe 25 — Informations sur le traitement","025171","Période à laquelle correspond la valeur moyenne de l'échantillon","s","0","0","10","s","0","4","","","Operational"
"25","Classe 25 — Informations sur le traitement","025172","Nombre d'échantillons","Numérique","0","0","10","Numérique","0","4","","","Operational"
"25","Classe 25 — Informations sur le traitement","025174","Indicateur des informations SMOS*","Table d'indicateurs","0","0","14","Table d'indicateurs","0","5","","","Operational"
"25","Classe 25 — Informations sur le traitement","025175","Valeur résiduelle modifiée","Numérique","2","0","13","Numérique","2","4","(voir note 7)","7","Operational"
"25","Classe 25 — Informations sur le traitement","025180","Pourcentage en mode basse résolution","%","2","0","16","%","2","5","","","Operational"
"25","Classe 25 — Informations sur le traitement","025181","Indicateur de traitement de niveau 2","Table de code","0","0","2","Table de code","0","1","","","Operational"
"25","Classe 25 — Informations sur le traitement","025182","Indicateur de traitement de niveau 1","Table de code","0","0","2","Table de code","0","1","","","Operational"
"25","Classe 25 — Informations sur le traitement","025183","Qualité du traitement de niveau 1","%","2","0","14","%","2","5","","","Operational"
"25","Classe 25 — Informations sur le traitement","025184","Catégorie de produit de niveau 2","Table de code","0","0","2","Table de code","0","1","","","Operational"
"25","Classe 25 — Informations sur le traitement","025185","Méthode de chiffrement","Table de code","0","0","8","Table de code","0","3","","","Operational"
"25","Classe 25 — Informations sur le traitement","025186","Version de la clef de chiffrement","CCITT IA5","0","0","96","Caractère","0","12","","","Operational"
"25","Classe 25 — Informations sur le traitement","025187","Indicateur de confiance","Table de code","0","0","4","Table de code","0","2","","","Operational"
"25","Classe 25 — Informations sur le traitement","025188","Méthode employée pour ramener la pression au niveau de la mer","Table de code","0","0","5","Table de code","0","2","","","Operational"
"25","Classe 25 — Informations sur le traitement","025189","Longueur d'onde de coupure dans la direction de visée","m","0","1","9","m","0","3","","","Operational"
